title,brand,category,slug,url
Steren COM-818 Repetidor Wi-Fi,Steren,Redes e internet,steren-com-818-repetidor-wi-fi,pages/resenas/steren-com-818-repetidor-wi-fi.html
Steren COM-446 Capturadora HDMI,Steren,Creación de contenido,steren-com-446-capturadora-hdmi,pages/resenas/steren-com-446-capturadora-hdmi.html
Steren SW-300 Reloj Inteligente,Steren,Wearables,steren-sw-300-reloj-inteligente,pages/resenas/steren-sw-300-reloj-inteligente.html
Steren AUD-7565 Freepods,Steren,Audio,steren-aud-7565-freepods,pages/resenas/steren-aud-7565-freepods.html
ViovaM2 Reproductor portátil HiFi,ViovaM2,Audio,viovam2-reproductor-portatil-hifi,pages/resenas/viovam2-reproductor-portatil-hifi.html
Steren CAM-700 Cámara Deportiva WiFi 4K,Steren,Redes e internet,steren-cam-700-camara-deportiva-wifi-4k,pages/resenas/steren-cam-700-camara-deportiva-wifi-4k.html
Steren SW-200 Reloj Inteligente,Steren,Wearables,steren-sw-200-reloj-inteligente,pages/resenas/steren-sw-200-reloj-inteligente.html
Alexa Echo Dot,Alexa,Tecnología general,alexa-echo-dot,pages/resenas/alexa-echo-dot.html
Alexa Echo Show,Alexa,Tecnología general,alexa-echo-show,pages/resenas/alexa-echo-show.html
Steren COM-852 Repetidor/Router Doble Banda,Steren,Redes e internet,steren-com-852-repetidor-router-doble-banda,pages/resenas/steren-com-852-repetidor-router-doble-banda.html
Steren CCTV-204 Cámara de CCVT,Steren,CCTV y seguridad,steren-cctv-204-camara-de-ccvt,pages/resenas/steren-cctv-204-camara-de-ccvt.html
Steren CCTV-218 Cámara de CCTV,Steren,CCTV y seguridad,steren-cctv-218-camara-de-cctv,pages/resenas/steren-cctv-218-camara-de-cctv.html
Steren POD-175 Receptor de Audio Bluetooth,Steren,Audio,steren-pod-175-receptor-de-audio-bluetooth,pages/resenas/steren-pod-175-receptor-de-audio-bluetooth.html
Samsung Galaxy Fit2 Pulsera Inteligente,Samsung,Wearables,samsung-galaxy-fit2-pulsera-inteligente,pages/resenas/samsung-galaxy-fit2-pulsera-inteligente.html
Steren NB-050 Mini Nobreak,Steren,Gadgets y accesorios,steren-nb-050-mini-nobreak,pages/resenas/steren-nb-050-mini-nobreak.html
Steren COM-880 Router 4G Portátil,Steren,Redes e internet,steren-com-880-router-4g-portatil,pages/resenas/steren-com-880-router-4g-portatil.html
GameStick Lite 4K Consola de VideoJuegos Retro,GameStick,Gaming,gamestick-lite-4k-consola-de-videojuegos-retro,pages/resenas/gamestick-lite-4k-consola-de-videojuegos-retro.html
GoPro Hero 9 Black Cámara Deportiva,GoPro,Drones y cámaras,gopro-hero-9-black-camara-deportiva,pages/resenas/gopro-hero-9-black-camara-deportiva.html
Steren AUD-570 Audífonos Gamer,Steren,Audio,steren-aud-570-audifonos-gamer,pages/resenas/steren-aud-570-audifonos-gamer.html
HolyStone HS430 MiniDron,HolyStone,Drones y cámaras,holystone-hs430-minidron,pages/resenas/holystone-hs430-minidron.html
Steren CCTV-238 Cámara de CCTV,Steren,CCTV y seguridad,steren-cctv-238-camara-de-cctv,pages/resenas/steren-cctv-238-camara-de-cctv.html
Steren INTV-110 TV Box,Steren,Pantallas y multimedia,steren-intv-110-tv-box,pages/resenas/steren-intv-110-tv-box.html
ES06 Disco Inteligente para Barrer,ES06,Gadgets y accesorios,es06-disco-inteligente-para-barrer,pages/resenas/es06-disco-inteligente-para-barrer.html
Steren COM-8235+ Adaptador USB WiFi Doble Banda,Steren,Redes e internet,steren-com-8235plus-adaptador-usb-wifi-doble-banda,pages/resenas/steren-com-8235plus-adaptador-usb-wifi-doble-banda.html
Steren INTV-1000 TV Box,Steren,Pantallas y multimedia,steren-intv-1000-tv-box,pages/resenas/steren-intv-1000-tv-box.html
Steren SmartWatch-400/SW Reloj Inteligente,Steren,Wearables,steren-smartwatch-400-sw-reloj-inteligente,pages/resenas/steren-smartwatch-400-sw-reloj-inteligente.html
Steren BOC-885/SW1 Bocinas Bluetooth TWS,Steren,Audio,steren-boc-885-sw1-bocinas-bluetooth-tws,pages/resenas/steren-boc-885-sw1-bocinas-bluetooth-tws.html
Alexa Echo Pop 1ra Gen,Alexa,Tecnología general,alexa-echo-pop-1ra-gen,pages/resenas/alexa-echo-pop-1ra-gen.html
Roku Premiere,Roku,Pantallas y multimedia,roku-premiere,pages/resenas/roku-premiere.html
Steren MOV-029 Micrófonos Inalámbricos,Steren,Audio,steren-mov-029-microfonos-inalambricos,pages/resenas/steren-mov-029-microfonos-inalambricos.html
Steren SHOME-LAM2 Barras Ambientales LED WiFi,Steren,Redes e internet,steren-shome-lam2-barras-ambientales-led-wifi,pages/resenas/steren-shome-lam2-barras-ambientales-led-wifi.html
Steren SW-400 Reloj Inteligente,Steren,Wearables,steren-sw-400-reloj-inteligente,pages/resenas/steren-sw-400-reloj-inteligente.html
Steren POD-TAG Rastreador Bluetooth para iOS,Steren,Gadgets y accesorios,steren-pod-tag-rastreador-bluetooth-para-ios,pages/resenas/steren-pod-tag-rastreador-bluetooth-para-ios.html
"LS02 Monitor Portátil HD 11.6""",LS02,Pantallas y multimedia,ls02-monitor-portatil-hd-11-6,pages/resenas/ls02-monitor-portatil-hd-11-6.html
Hytobp Monster P2 Dron,Hytobp,Drones y cámaras,hytobp-monster-p2-dron,pages/resenas/hytobp-monster-p2-dron.html
Steren COM-816 Repetidor WiFi,Steren,Redes e internet,steren-com-816-repetidor-wifi,pages/resenas/steren-com-816-repetidor-wifi.html
Hytobp S177 Dron,Hytobp,Drones y cámaras,hytobp-s177-dron,pages/resenas/hytobp-s177-dron.html
Steren SMW-420 Reloj Inteligente,Steren,Wearables,steren-smw-420-reloj-inteligente,pages/resenas/steren-smw-420-reloj-inteligente.html
Steren SMW-500 Reloj Inteligente,Steren,Wearables,steren-smw-500-reloj-inteligente,pages/resenas/steren-smw-500-reloj-inteligente.html
Steren SMW-440 Reloj Inteligente,Steren,Wearables,steren-smw-440-reloj-inteligente,pages/resenas/steren-smw-440-reloj-inteligente.html
SkullCandy Smoking Buds Audífonos Bluetooth,SkullCandy,Audio,skullcandy-smoking-buds-audifonos-bluetooth,pages/resenas/skullcandy-smoking-buds-audifonos-bluetooth.html
Steren AUD-7440 Audífonos Bluetooth,Steren,Audio,steren-aud-7440-audifonos-bluetooth,pages/resenas/steren-aud-7440-audifonos-bluetooth.html
Redmi Watch 5 Active Reloj Inteligente,Redmi,Wearables,redmi-watch-5-active-reloj-inteligente,pages/resenas/redmi-watch-5-active-reloj-inteligente.html
Steren PRO-260 Mini Proyector HD,Steren,Pantallas y multimedia,steren-pro-260-mini-proyector-hd,pages/resenas/steren-pro-260-mini-proyector-hd.html
Steren COM-016 Control Bluetooth Para VideoJuegos,Steren,Gaming,steren-com-016-control-bluetooth-para-videojuegos,pages/resenas/steren-com-016-control-bluetooth-para-videojuegos.html
Steren AUD-7100 Audífonos Bluetooth Para Lentes,Steren,Audio,steren-aud-7100-audifonos-bluetooth-para-lentes,pages/resenas/steren-aud-7100-audifonos-bluetooth-para-lentes.html
ASUS Chromebook CX1500,ASUS,Pantallas y multimedia,asus-chromebook-cx1500,pages/resenas/asus-chromebook-cx1500.html
Steren CCTV-203 Cámara de CCTV,Steren,CCTV y seguridad,steren-cctv-203-camara-de-cctv,pages/resenas/steren-cctv-203-camara-de-cctv.html
"Steren PB-2010C Batería de Respaldo 10,000 mAh",Steren,Gadgets y accesorios,steren-pb-2010c-bateria-de-respaldo-10-000-mah,pages/resenas/steren-pb-2010c-bateria-de-respaldo-10-000-mah.html
Steren MIC-9100 Micrófonos Inalámbricos,Steren,Audio,steren-mic-9100-microfonos-inalambricos,pages/resenas/steren-mic-9100-microfonos-inalambricos.html
GameSir T7 Control Alámbrico Gamer,GameSir,Gaming,gamesir-t7-control-alambrico-gamer,pages/resenas/gamesir-t7-control-alambrico-gamer.html
Xiaomi UDFine MicLite Micrófonos Inalámbricos,Xiaomi,Audio,xiaomi-udfine-miclite-microfonos-inalambricos,pages/resenas/xiaomi-udfine-miclite-microfonos-inalambricos.html
Lenovo Legion Go S Consola Portátil,Lenovo,Gaming,lenovo-legion-go-s-consola-portatil,pages/resenas/lenovo-legion-go-s-consola-portatil.html
Steren AUD-7150 Audífonos OWS Bluetooth,Steren,Audio,steren-aud-7150-audifonos-ows-bluetooth,pages/resenas/steren-aud-7150-audifonos-ows-bluetooth.html
KZ EDX Pro Audífonos Alámbricos,KZ,Audio,kz-edx-pro-audifonos-alambricos,pages/resenas/kz-edx-pro-audifonos-alambricos.html
KZ AZ09 Módulo Bluetooth Para Audífonos,KZ,Audio,kz-az09-modulo-bluetooth-para-audifonos,pages/resenas/kz-az09-modulo-bluetooth-para-audifonos.html
"MSI PRO MP273QW E2 Monitor de 27""",MSI,Pantallas y multimedia,msi-pro-mp273qw-e2-monitor-de-27,pages/resenas/msi-pro-mp273qw-e2-monitor-de-27.html
Krioz K7 Audífonos Gamer,Krioz,Audio,krioz-k7-audifonos-gamer,pages/resenas/krioz-k7-audifonos-gamer.html
Steren MIC-560 Micrófono Para PodCast,Steren,Audio,steren-mic-560-microfono-para-podcast,pages/resenas/steren-mic-560-microfono-para-podcast.html
Retekess V115 Radio AM-FM Multmedia,Retekess,Audio,retekess-v115-radio-am-fm-multmedia,pages/resenas/retekess-v115-radio-am-fm-multmedia.html
Retevis RT22 Radios de comunicación,Retevis,Audio,retevis-rt22-radios-de-comunicacion,pages/resenas/retevis-rt22-radios-de-comunicacion.html
Steren GAM-200 Control Inalámbrico Gamer,Steren,Gaming,steren-gam-200-control-inalambrico-gamer,pages/resenas/steren-gam-200-control-inalambrico-gamer.html
"T-WOLF TF200 Kit Teclado, mouse y pad Gamer",T-WOLF,Gaming,t-wolf-tf200-kit-teclado-mouse-y-pad-gamer,pages/resenas/t-wolf-tf200-kit-teclado-mouse-y-pad-gamer.html
Zyama ZM33-B Barra de Sonido para PC,Zyama,Audio,zyama-zm33-b-barra-de-sonido-para-pc,pages/resenas/zyama-zm33-b-barra-de-sonido-para-pc.html
